{
  "$schema": "https://raw.githubusercontent.com/andremjr/contentflow/main/docs/ecosystem/schemas/contentflow-plugin-v2.schema.json",
  "apiVersion": "2",
  "id": "official-openai-gpt",
  "name": "OpenAI Models",
  "version": "2.0.1",
  "description": "Executa qualquer bloco baseado em linguagem com um modelo de texto compatível com a Responses API da OpenAI.",
  "author": "ContentFlow",
  "license": "MIT",
  "branding": {
    "iconPath": "assets/icon.png"
  },
  "homepage": "https://github.com/andremjr/contentflow",
  "repository": "https://github.com/andremjr/plugins-contentflow",
  "runtime": {
    "kind": "node",
    "version": ">=22",
    "module": "esm"
  },
  "minCoreVersion": "1.3.3",
  "entrypoint": "handler.ts",
  "permissions": [
    "network"
  ],
  "networkHosts": [
    "api.openai.com"
  ],
  "secretKeys": [
    "OPENAI_API_KEY"
  ],
  "capabilities": [
    {
      "id": "generate-or-validate-text",
      "operator": "IA",
      "instructionUsage": "optional",
      "promptPreview": {
        "template": "INSTRUÇÕES DO PROVEDOR:\n{{CONFIG:system_prompt}}\n\nMENSAGEM ENVIADA:\nCanal: {{CHANNEL_NAME}}\nNicho: {{NICHE}}\nProjeto: {{PROJECT_TITLE}}\nProcesso: {{PROCESS}}\nAção: {{BLOCK_NAME}}\nTipo de ação: {{BLOCK_TYPE}}\n\nInstruções da ação:\n{{BLOCK_INSTRUCTIONS}}\n\nEntradas resolvidas:\n{{ALL_INPUTS}}\n\n{{OUTPUT_CONTRACT}}"
      },
      "blockTypes": [
        "BUSCAR",
        "ESCOLHER",
        "CRIAR",
        "VALIDAR"
      ],
      "processTypes": [
        "theme",
        "title",
        "thumbnail",
        "script",
        "narration",
        "assets",
        "editing",
        "publishing"
      ],
      "inputPorts": [
        {
          "key": "context",
          "label": "Contexto",
          "required": false,
          "shape": {
            "kind": "content",
            "family": "text",
            "cardinality": "one",
            "representation": "inline"
          }
        }
      ],
      "outputPorts": [
        {
          "key": "result",
          "label": "Resultado",
          "required": true,
          "shape": {
            "kind": "content",
            "family": "text",
            "cardinality": "one",
            "representation": "inline"
          }
        }
      ],
      "execution": {
        "mode": "immediate",
        "defaultTimeoutMs": 120000,
        "supportsCancellation": false,
        "maxConcurrency": 1
      },
      "sideEffects": [
        "external_read",
        "external_write"
      ],
      "cost": {
        "model": "metered",
        "estimateSupported": false
      },
      "dataPolicy": {
        "sendsDataToThirdParties": true,
        "providers": [
          "OpenAI"
        ],
        "retentionPolicyUrl": "https://platform.openai.com/docs/guides/your-data",
        "trainingPolicyUrl": "https://platform.openai.com/docs/guides/your-data"
      },
      "blockConfigSchema": {
        "type": "object",
        "properties": {
          "model": {
            "type": "string",
            "title": "Modelo OpenAI",
            "description": "Escolha o equilíbrio desejado entre qualidade e custo. A disponibilidade depende da sua conta OpenAI.",
            "default": "gpt-5.6-terra",
            "oneOf": [
              {
                "const": "gpt-5.6-sol",
                "title": "GPT-5.6 Sol — máxima qualidade"
              },
              {
                "const": "gpt-5.6-terra",
                "title": "GPT-5.6 Terra — equilibrado"
              },
              {
                "const": "gpt-5.6-luna",
                "title": "GPT-5.6 Luna — econômico"
              },
              {
                "const": "gpt-5.5",
                "title": "GPT-5.5"
              },
              {
                "const": "gpt-5.4",
                "title": "GPT-5.4"
              },
              {
                "const": "gpt-5.4-mini",
                "title": "GPT-5.4 mini"
              },
              {
                "const": "gpt-5.4-nano",
                "title": "GPT-5.4 nano"
              },
              {
                "const": "gpt-5-mini",
                "title": "GPT-5 mini — geração anterior"
              }
            ]
          },
          "system_prompt": {
            "type": "string",
            "title": "Prompt de sistema",
            "format": "textarea",
            "default": "Execute as instruções do bloco usando o contexto disponível e respeite exatamente o contrato de saída."
          },
          "temperature": {
            "type": "number",
            "title": "Temperatura",
            "description": "Quando o modelo não aceitar temperatura, o plugin tentará novamente sem este parâmetro.",
            "minimum": 0,
            "maximum": 2,
            "default": 0.7
          }
        }
      },
      "outputSchema": {
        "type": "object"
      }
    }
  ]
}
