{
  "apiVersion": "2",
  "id": "contentflow.manual-tool-launcher",
  "name": "Abrir ferramenta manual",
  "version": "2.0.0",
  "description": "Abre um navegador configurado com perfil e URL HTTPS ou um aplicativo local para o operador humano continuar o trabalho manualmente.",
  "author": "ContentFlow",
  "license": "LicenseRef-ContentFlow-Source-Available-1.0",
  "branding": {
    "iconPath": "assets/icon.png"
  },
  "runtime": {
    "kind": "node",
    "version": ">=26 <27",
    "module": "esm"
  },
  "minCoreVersion": "1.3.1",
  "entrypoint": "handler.mjs",
  "permissions": [
    "process"
  ],
  "capabilities": [
    {
      "id": "open-tool",
      "operator": "Humano",
      "instructionUsage": "not_applicable",
      "blockTypes": [
        "BUSCAR",
        "ESCOLHER",
        "CRIAR",
        "VALIDAR"
      ],
      "inputPorts": [],
      "outputPorts": [
        {
          "key": "opened",
          "label": "Ferramenta aberta",
          "required": false,
          "shape": {
            "kind": "control",
            "control": "boolean",
            "cardinality": "one"
          }
        }
      ],
      "execution": {
        "mode": "immediate",
        "defaultTimeoutMs": 30000,
        "maxConcurrency": 1
      },
      "sideEffects": [
        "subprocess"
      ],
      "cost": {
        "model": "free",
        "estimateSupported": false
      },
      "dataPolicy": {
        "sendsDataToThirdParties": false
      },
      "blockConfigSchema": {
        "type": "object",
        "additionalProperties": false,
        "properties": {
          "destinationType": {
            "type": "string",
            "title": "Tipo de destino",
            "enum": [
              "browser",
              "application"
            ],
            "default": "browser"
          },
          "browserExecutablePath": {
            "type": "string",
            "title": "Executável do navegador",
            "default": ""
          },
          "browserProfilePath": {
            "type": "string",
            "title": "Pasta do perfil",
            "default": ""
          },
          "url": {
            "type": "string",
            "title": "URL HTTPS",
            "default": "https://"
          },
          "applicationExecutablePath": {
            "type": "string",
            "title": "Executável do aplicativo",
            "default": ""
          }
        }
      },
      "outputSchema": {
        "type": "object",
        "additionalProperties": false,
        "properties": {
          "opened": {
            "type": "boolean"
          }
        }
      }
    }
  ],
  "$schema": "https://raw.githubusercontent.com/andremjr/contentflow/main/docs/ecosystem/schemas/contentflow-plugin-v2.schema.json"
}
