{
  "$schema": "https://raw.githubusercontent.com/andremjr/contentflow/main/docs/ecosystem/schemas/contentflow-plugin-v2.schema.json",
  "apiVersion": "2",
  "id": "official-ffmpeg-image-sequence-video",
  "name": "Vídeo por Sequência de Imagens (FFmpeg)",
  "version": "1.1.0",
  "description": "Monta um vídeo MP4 local com imagens ordenadas, sincronizadas pela duração do áudio ou pelos intervalos de um SRT.",
  "author": "ContentFlow",
  "license": "LicenseRef-ContentFlow-Source-Available-1.0",
  "branding": {
    "iconPath": "assets/icon.png"
  },
  "homepage": "https://github.com/andremjr/contentflow",
  "repository": "https://github.com/andremjr/contentflow",
  "runtime": {
    "kind": "node",
    "version": ">=26 <27",
    "module": "esm"
  },
  "minCoreVersion": "0.4.1",
  "entrypoint": "handler.mjs",
  "permissions": [
    "filesystem:read",
    "filesystem:write",
    "process"
  ],
  "capabilities": [
    {
      "id": "compose-image-sequence-with-audio",
      "operator": "Código",
      "blockTypes": [
        "CRIAR"
      ],
      "processTypes": [
        "editing"
      ],
      "inputPorts": [
        {
          "key": "images",
          "label": "Imagens ordenadas",
          "description": "Imagens exibidas na ordem recebida e distribuídas igualmente pela duração total do áudio.",
          "required": true,
          "presentation": {
            "renderer": "image-gallery"
          },
          "shape": {
            "kind": "content",
            "family": "image",
            "cardinality": "many",
            "representation": "artifact",
            "formats": {
              "mimeTypes": [
                "image/jpeg",
                "image/png",
                "image/webp"
              ]
            }
          }
        },
        {
          "key": "audio",
          "label": "Áudio final",
          "description": "Faixa de áudio que determina a duração exata do vídeo.",
          "required": true,
          "presentation": {
            "renderer": "audio-player"
          },
          "shape": {
            "kind": "content",
            "family": "audio",
            "cardinality": "one",
            "representation": "artifact",
            "formats": {
              "mimeTypes": [
                "audio/aac",
                "audio/flac",
                "audio/mp4",
                "audio/mpeg",
                "audio/ogg",
                "audio/opus",
                "audio/wav",
                "audio/webm",
                "audio/x-m4a"
              ]
            }
          }
        },
        {
          "key": "subtitles",
          "label": "Legendas SRT",
          "description": "Arquivo SRT opcional cujos cues determinam a troca das imagens quando o modo SRT está ativo.",
          "required": false,
          "presentation": {
            "renderer": "file-list"
          },
          "shape": {
            "kind": "content",
            "family": "text",
            "cardinality": "many",
            "representation": "artifact",
            "formats": {
              "mimeTypes": [
                "application/x-subrip",
                "text/plain",
                "text/srt",
                "text/x-srt"
              ]
            }
          }
        }
      ],
      "outputPorts": [
        {
          "key": "video",
          "label": "Vídeo final",
          "description": "Vídeo MP4 H.264 16:9 com o áudio sincronizado.",
          "required": true,
          "presentation": {
            "renderer": "video-player"
          },
          "shape": {
            "kind": "content",
            "family": "video",
            "cardinality": "one",
            "representation": "artifact",
            "formats": {
              "mimeTypes": [
                "video/mp4"
              ]
            }
          }
        }
      ],
      "execution": {
        "mode": "immediate",
        "defaultTimeoutMs": 600000,
        "supportsCancellation": false,
        "maxConcurrency": 1
      },
      "sideEffects": [
        "local_artifact",
        "subprocess"
      ],
      "cost": {
        "model": "free",
        "estimateSupported": false
      },
      "dataPolicy": {
        "sendsDataToThirdParties": false
      },
      "blockConfigSchema": {
        "type": "object",
        "additionalProperties": false,
        "properties": {
          "width": {
            "type": "integer",
            "title": "Largura",
            "minimum": 320,
            "maximum": 3840,
            "default": 1920
          },
          "height": {
            "type": "integer",
            "title": "Altura",
            "minimum": 180,
            "maximum": 2160,
            "default": 1080
          },
          "fps": {
            "type": "integer",
            "title": "Quadros por segundo",
            "enum": [
              24,
              25,
              30,
              50,
              60
            ],
            "default": 30
          },
          "imageFit": {
            "type": "string",
            "title": "Enquadramento",
            "enum": [
              "cover",
              "contain"
            ],
            "default": "cover"
          },
          "backgroundColor": {
            "type": "string",
            "title": "Cor de fundo",
            "pattern": "^#[0-9A-Fa-f]{6}$",
            "default": "#000000"
          },
          "videoQuality": {
            "type": "integer",
            "title": "Qualidade H.264 (CRF)",
            "description": "Valores menores geram mais qualidade e arquivos maiores.",
            "minimum": 16,
            "maximum": 30,
            "default": 20
          },
          "timingMode": {
            "type": "string",
            "title": "Distribuição das imagens",
            "description": "Use SRT para trocar as imagens nos finais dos cues de legenda.",
            "enum": [
              "equal",
              "srt"
            ],
            "default": "equal"
          }
        },
        "required": [
          "width",
          "height",
          "fps",
          "imageFit",
          "backgroundColor",
          "videoQuality"
        ]
      },
      "outputSchema": {
        "type": "object",
        "additionalProperties": false,
        "properties": {
          "video": {
            "type": "object",
            "additionalProperties": false,
            "properties": {
              "id": {
                "type": "string"
              },
              "name": {
                "type": "string"
              },
              "mimeType": {
                "const": "video/mp4"
              },
              "size": {
                "type": "integer",
                "minimum": 1
              },
              "url": {
                "type": "string",
                "pattern": "^artifact://"
              }
            },
            "required": [
              "id",
              "name",
              "mimeType",
              "size",
              "url"
            ]
          }
        },
        "required": [
          "video"
        ]
      }
    }
  ]
}
